{
  "apiVersion": "loop-engineering/v1",
  "loop": "example-loop",
  "experimentId": "strategy-v2-benchmark",
  "experimentSha256": "0000000000000000000000000000000000000000000000000000000000000000",
  "decision": "reject",
  "actor": "human-reviewer",
  "decidedAt": "2026-07-12T00:00:00Z",
  "reason": "The matched evidence does not justify promotion."
}
